{
  "title": "Meu Curso Didatik",
  "subtitle": "Curso a ser criado pelos agentes educacionais",
  "author": "Didatik",
  "version": "0.1.0",
  "tags": [
    "didatik"
  ],
  "description": "Este curso ainda não foi planejado. Use *dk course create para criar o curso com os agentes @teixeira, @cora e @andrade.",
  "objectives": [],
  "skills": [],
  "audience": "A definir pelo planejamento",
  "total_modules": 0,
  "total_lessons": 0,
  "total_duration": 0
}